<?xml version="1.0" encoding="UTF-8" standalone="yes"?>
<hot:hotel xmlns:hot="http://www.example.org/HotelDB" xmlns:xsi="http://www.w3.org/2001/XMLSchema-instance" xsi:schemaLocation="http://www.example.org/HotelDB ../../src/SC12Project/Milestone1/HotelReservation/HotelDB.xsd">
    <hot:rooms>
        <hot:room>
            <hot:type>standard</hot:type>
            <hot:totalAmount>50</hot:totalAmount>
            <hot:rate>100</hot:rate>
        </hot:room>
        <hot:room>
            <hot:type>deluxe</hot:type>
            <hot:totalAmount>10</hot:totalAmount>
            <hot:rate>350</hot:rate>
        </hot:room>
        <hot:room>
            <hot:type>president</hot:type>
            <hot:totalAmount>1</hot:totalAmount>
            <hot:rate>3000</hot:rate>
        </hot:room>
    </hot:rooms>
    <hot:bookings>
        <hot:booking>
            <hot:bookingID>bookingOne</hot:bookingID>
            <hot:type>standard</hot:type>
            <hot:amount>3</hot:amount>
            <hot:stayPeriod>
                <hot:checkin>
                    <hot:year>2012</hot:year>
                    <hot:month>1</hot:month>
                    <hot:date>1</hot:date>
                </hot:checkin>
                <hot:checkout>
                    <hot:year>2012</hot:year>
                    <hot:month>1</hot:month>
                    <hot:date>2</hot:date>
                </hot:checkout>
            </hot:stayPeriod>
        </hot:booking>
        <hot:booking>
            <hot:bookingID>bookingTwo</hot:bookingID>
            <hot:type>standard</hot:type>
            <hot:amount>3</hot:amount>
            <hot:stayPeriod>
                <hot:checkin>
                    <hot:year>2012</hot:year>
                    <hot:month>1</hot:month>
                    <hot:date>1</hot:date>
                </hot:checkin>
                <hot:checkout>
                    <hot:year>2012</hot:year>
                    <hot:month>1</hot:month>
                    <hot:date>5</hot:date>
                </hot:checkout>
            </hot:stayPeriod>
        </hot:booking>
    </hot:bookings>
</hot:hotel>
